<?xml version="1.0"?>
<!DOCTYPE Report
[
<!ELEMENT Report (General ,(Doc|BPT)) >
<!ATTLIST Report ver CDATA #REQUIRED tmZone CDATA #REQUIRED>

<!ELEMENT General ( DocLocation ) >
<!ATTLIST General productName CDATA #REQUIRED productVer CDATA #REQUIRED os CDATA #REQUIRED host CDATA #REQUIRED qcserver CDATA #IMPLIED qcproject CDATA #IMPLIED SolManSolutionId CDATA #IMPLIED SolManProjectId CDATA #IMPLIED SolManTestPlanId CDATA #IMPLIED SolManTestPackageId CDATA #IMPLIED SolManUserInfoData CDATA #IMPLIED  >

<!ELEMENT BPT (DName,Res,DVer?,TSet?,TInst?,NodeArgs,AdditionalInfo*,Doc*) >
<!ATTLIST BPT rID ID #REQUIRED >

<!ELEMENT Doc (DName,ConfName?,Res,DVer?,TSet?,TInst?,RunType?,DT?,AdditionalInfo*,Step*,DIter*,Step*,Action*,Doc*,Summary?,TestMaintenanceSummary*,NodeArgs?) >
<!ATTLIST Doc rID ID #REQUIRED type (Test|BC|BPTWrapperTest|Flow|Group|Action) "Test" productName CDATA #REQUIRED BCIter CDATA #IMPLIED >

<!ELEMENT RunType ( #PCDATA )>
<!ATTLIST RunType fmStep (False|True) "False" batch (False|True) "False" upDesc (False|True) "False" upChk (False|True) "False" upAS (False|True) "False">

<!ELEMENT DName ( #PCDATA ) >

<!ELEMENT ConfName ( #PCDATA ) >

<!ELEMENT Res ( #PCDATA ) >

<!ELEMENT AdditionalInfo (AdditionalDataName,AdditionalDataValue ) >

<!ELEMENT AdditionalDataName ( #PCDATA ) >

<!ELEMENT AdditionalDataValue ( #PCDATA ) >

<!ELEMENT DVer ( #PCDATA ) >

<!ELEMENT TSet ( #PCDATA ) >

<!ELEMENT TInst ( #PCDATA ) >

<!ELEMENT DIter (Step*,Action+,Summary?,NodeArgs)>
<!ATTLIST DIter rID ID #REQUIRED iterID CDATA #REQUIRED>

<!ELEMENT DocLocation ( #PCDATA )>

<!ELEMENT Action (AName,AIter*,(Step|HtmlStep|Action)*, Summary,ActionMaintenanceSummary*, NodeArgs ) >
<!ATTLIST Action rID ID #REQUIRED>

<!ELEMENT AIter ((Step|HtmlStep|Action)*,DataMapping?, Summary?,NodeArgs) >
<!ATTLIST AIter rID ID #REQUIRED iterID CDATA #REQUIRED isCountable (False|True) "False" >

<!ELEMENT AName ( #PCDATA ) >

<!ELEMENT TestMaintenanceSummary (ActionMaintenanceSummary*) >
<!ATTLIST TestMaintenanceSummary ObjectsAdded CDATA #REQUIRED ObjectsUpdated CDATA #REQUIRED StepsUpdated CDATA #REQUIRED StepsComments CDATA #REQUIRED><!ELEMENT ActionMaintenanceSummary (ObjectChange* ) >
<!ATTLIST ActionMaintenanceSummary Action CDATA #REQUIRED Objects CDATA #REQUIRED Updated CDATA #REQUIRED LinesTotal CDATA #REQUIRED Added CDATA #REQUIRED LinesUpdated CDATA #REQUIRED>

<!ELEMENT ObjectChange  (Hierarchy, PropertyChangeList* ) >
<!ATTLIST ObjectChange Operation CDATA #IMPLIED OriginalRepository CDATA #IMPLIED>

<!ELEMENT PropertyChangeList (PropertyDef*) >

<!ELEMENT PropertyDef (OriginalValue, NewValue) >
<!ATTLIST PropertyDef PropName CDATA #REQUIRED OriginRegularExpression (True|False) "False" NewRegularExpression (True|False) "False" AddedProperty (True|False) "False" >

<!ELEMENT OriginalValue ( #PCDATA )>

<!ELEMENT NewValue ( #PCDATA )>

<!ELEMENT Hierarchy  (ObjectName, Hierarchy*) >
<!ATTLIST Hierarchy MicClass CDATA #REQUIRED>

<!ELEMENT ObjectName  ( #PCDATA ) >

<!ELEMENT Step (Obj,Details,Time,TimeTick* ,(Step|HtmlStep|Doc)*, DataMapping?, NodeArgs) >
<!ATTLIST Step rID ID #REQUIRED retval CDATA #IMPLIED>

<!ELEMENT HtmlStep (HTML,TimeTick*,(Step|HtmlStep|Doc)*,NodeArgs) >
<!ATTLIST HtmlStep rID ID #REQUIRED >

<!ELEMENT Obj ( #PCDATA ) >
<!ATTLIST Obj plainTxt (False|True) "True">

<!ELEMENT Details ( #PCDATA ) >
<!ATTLIST Details plainTxt (False|True) "True">

<!ELEMENT Time ( #PCDATA ) >

<!ELEMENT HTML ( #PCDATA ) >

<!ELEMENT Disp ( #PCDATA ) >

<!ELEMENT TimeTick ( #PCDATA ) >

<!ELEMENT DataMapping ( DataMappedItem* )>
<!ELEMENT DataMappedItem EMPTY >
<!ATTLIST DataMappedItem dsName CDATA #REQUIRED >
<!ATTLIST DataMappedItem rowId CDATA #REQUIRED >

<!ELEMENT NodeArgs (Disp,TopPane?,BtmPane?,ExtendedInfo? )>
<!ATTLIST NodeArgs eType CDATA #REQUIRED icon CDATA #REQUIRED nRep CDATA #REQUIRED UserNote CDATA #IMPLIED filter (False|True) "True">
<!ATTLIST NodeArgs status (Passed|Failed|Done|Warning|Information) "Done">
<!ATTLIST NodeArgs iconSel CDATA #IMPLIED nType CDATA #IMPLIED MovieMarker CDATA "">
<!ATTLIST NodeArgs Source CDATA #IMPLIED SourceLine CDATA #IMPLIED StepFlowItemKey CDATA #IMPLIED >

<!ELEMENT TopPane (Path)>

<!ELEMENT BtmPane ( (Path|WR)?,ASHilite?)>
<!ATTLIST BtmPane vType CDATA "HTML">

<!ELEMENT Path ( #PCDATA ) >

<!ELEMENT ASHilite ( #PCDATA ) >

<!ELEMENT WR ( #PCDATA ) >

<!ELEMENT ExtendedInfo ( StepData ) >

<!ATTLIST ExtendedInfo StepType CDATA #REQUIRED>
<!ELEMENT DT (NodeArgs) >
<!ATTLIST DT rID ID #REQUIRED>

<!ELEMENT Summary (Param*)>
<!ATTLIST Summary sTime CDATA #IMPLIED eTime CDATA #IMPLIED passed CDATA #IMPLIED failed CDATA #IMPLIED warnings CDATA #IMPLIED retval CDATA #IMPLIED stopped (False|True) "False" >

<!ELEMENT Param (ParamName,ParamVal)+ >
<!ATTLIST Param paramInOut (In|Out) "In">

<!ELEMENT ParamName ( #PCDATA ) >

<!ELEMENT ParamVal ( #PCDATA ) >

]
>
<Report ver="2.0" tmZone="SE Asia Standard Time">
<General productName="HP Unified Functional Testing" productVer="12.01" os="Windows 8" host="NOTEBOOK"><DocLocation><![CDATA[C:\ESD_Test\Bin\ESD_Test]]></DocLocation></General>
<Doc rID="T1"   productName= "HP Unified Functional Testing"  >
<DName><![CDATA[ESD_Test]]></DName>
<Res><![CDATA[Res189]]></Res>
<DT rID="T2">
<NodeArgs eType="Table" icon="2" nRep="4" filter="False" >
<Disp><![CDATA[Run-Time Data Table]]></Disp>
<BtmPane vType="Table" >
<Path><![CDATA[Default.xls]]></Path>
</BtmPane>
</NodeArgs>
</DT>
<DIter rID="T3" iterID="1" >
<Step rID="T4">
<Obj plainTxt="False" ><![CDATA[StartUp Browser]]></Obj>
<Details plainTxt="False" ><![CDATA[Browser]]></Details>
<Time><![CDATA[9/9/2014 - 12:02:43]]></Time>
<TimeTick>1410238963</TimeTick>
<Step rID="T5">
<Obj plainTxt="False" ><![CDATA[StartUp Browser]]></Obj>
<Details plainTxt="False" ><![CDATA[Navigate to http://tfs.innoria.com:3000/]]></Details>
<Time><![CDATA[9/9/2014 - 12:02:43]]></Time>
<TimeTick>1410238963</TimeTick>
<NodeArgs eType="Replay" icon="4" nRep="9" nType="Navigate to http://tfs.innoria.com:3000/" Source="Action0" SourceLine="-1" >
<Disp><![CDATA[StartUp Browser]]></Disp>
</NodeArgs>
</Step>
<Step rID="T6">
<Obj plainTxt="False" ><![CDATA[StartUp Browser.Sync]]></Obj>
<Details plainTxt="False" ><![CDATA[]]></Details>
<Time><![CDATA[9/9/2014 - 12:02:44]]></Time>
<TimeTick>1410238964</TimeTick>
<NodeArgs eType="Replay" icon="4" nRep="11" Source="Action0" SourceLine="-1" >
<Disp><![CDATA[StartUp Browser.Sync]]></Disp>
</NodeArgs>
</Step>
<NodeArgs eType="Context" icon="4" nRep="8" Source="Action0" SourceLine="-1" >
<Disp><![CDATA[StartUp Browser]]></Disp>
</NodeArgs>
</Step>
<Action rID="T7">
<AName><![CDATA[ESD]]></AName>
<Step rID="T8">
<Obj ><![CDATA[Get Page'Login_Page' at Browser 'eSkyDesk Management' successfully ]]></Obj>
<Details ><![CDATA[Passed]]></Details>
<Time><![CDATA[9/9/2014 - 12:02:48]]></Time>
<TimeTick>1410238968</TimeTick>
<NodeArgs eType="User" icon="6" nRep="13" status="Passed" >
<Disp><![CDATA[Get Page'Login_Page' at Browser 'eSkyDesk Management' successfully ]]></Disp>
</NodeArgs>
</Step>
<Step rID="T9">
<Obj plainTxt="False" ><![CDATA[eSkyDesk Management]]></Obj>
<Details plainTxt="False" ><![CDATA[Browser]]></Details>
<Time><![CDATA[9/9/2014 - 12:02:53]]></Time>
<TimeTick>1410238973</TimeTick>
<Step rID="T10">
<Obj plainTxt="False" ><![CDATA[Login_Page]]></Obj>
<Details plainTxt="False" ><![CDATA[Page]]></Details>
<Time><![CDATA[9/9/2014 - 12:02:53]]></Time>
<TimeTick>1410238973</TimeTick>
<Step rID="T11">
<Obj plainTxt="False" ><![CDATA[Login.Exist]]></Obj>
<Details plainTxt="False" ><![CDATA["Object exists"]]></Details>
<Time><![CDATA[9/9/2014 - 12:02:53]]></Time>
<TimeTick>1410238973</TimeTick>
<NodeArgs eType="Replay" icon="8" nRep="17" >
<Disp><![CDATA[Login.Exist]]></Disp>
</NodeArgs>
</Step>
<Step rID="T12">
<Obj plainTxt="False" ><![CDATA[Login.Click]]></Obj>
<Details plainTxt="False" ><![CDATA[]]></Details>
<Time><![CDATA[9/9/2014 - 12:02:53]]></Time>
<TimeTick>1410238973</TimeTick>
<NodeArgs eType="Replay" icon="8" nRep="19" >
<Disp><![CDATA[Login.Click]]></Disp>
</NodeArgs>
</Step>
<Step rID="T13">
<Obj plainTxt="False" ><![CDATA[[ Window ].Exist]]></Obj>
<Details plainTxt="False" ><![CDATA["Object does not exist"]]></Details>
<Time><![CDATA[9/9/2014 - 12:02:54]]></Time>
<TimeTick>1410238974</TimeTick>
<NodeArgs eType="Replay" icon="9" nRep="21" >
<Disp><![CDATA[[ Window ].Exist]]></Disp>
</NodeArgs>
</Step>
<NodeArgs eType="Context" icon="7" nRep="16" >
<Disp><![CDATA[Login_Page]]></Disp>
</NodeArgs>
</Step>
<NodeArgs eType="Context" icon="4" nRep="15" >
<Disp><![CDATA[eSkyDesk Management]]></Disp>
</NodeArgs>
</Step>
<Step rID="T14">
<Obj ><![CDATA[Get Page'New_BP_Page' at Browser 'eSkyDesk Management' successfully ]]></Obj>
<Details ><![CDATA[Passed]]></Details>
<Time><![CDATA[9/9/2014 - 12:02:58]]></Time>
<TimeTick>1410238978</TimeTick>
<NodeArgs eType="User" icon="6" nRep="22" status="Passed" >
<Disp><![CDATA[Get Page'New_BP_Page' at Browser 'eSkyDesk Management' successfully ]]></Disp>
</NodeArgs>
</Step>
<Step rID="T15">
<Obj plainTxt="False" ><![CDATA[eSkyDesk Management]]></Obj>
<Details plainTxt="False" ><![CDATA[Browser]]></Details>
<Time><![CDATA[9/9/2014 - 12:03:00]]></Time>
<TimeTick>1410238980</TimeTick>
<Step rID="T16">
<Obj plainTxt="False" ><![CDATA[New_BP_Page]]></Obj>
<Details plainTxt="False" ><![CDATA[Page]]></Details>
<Time><![CDATA[9/9/2014 - 12:03:00]]></Time>
<TimeTick>1410238980</TimeTick>
<Step rID="T17">
<Obj plainTxt="False" ><![CDATA[Add Batch Profile]]></Obj>
<Details plainTxt="False" ><![CDATA[WebElement]]></Details>
<Time><![CDATA[9/9/2014 - 12:03:00]]></Time>
<TimeTick>1410238980</TimeTick>
<HtmlStep rID="T18">
<HTML><![CDATA[<html>
<head>
<META HTTP-EQUIV="Content-Type" CONTENT="text/html; charset=UTF-8"/>
<base href=""/>
<link rel="stylesheet" href="Results.css"/>
</head>
<body bgcolor="#ffffff" leftmargin="20" marginwidth="20" topmargin="10" marginheight="10" vlink="#9966cc">
<table border="0" cellpadding="0" cellspacing="0" width="100%">
	<tr><td height="1" class="bg_midblue"></td></tr>
	<tr><td height="30"><span class="hl1"> Bitmap Checkpoint "Add Batch Profile": </span><span class="PassedHigh">Passed</span></td></tr>
	<tr><td height="2" class="bg_darkblue"></td></tr>
	<tr><td height="10"></td></tr>
	<tr><td><span class="text"><b>Date and Time:</b> 9/9/2014 - 12:03:00</span></td></tr>
		
	<tr><td height="15"></td></tr>
</table>
<!--Until here code from report media-->
<table border="0" cellpadding="0" cellspacing="0" width="100%" id=TABLE2><tr height="1"><td height="1" class="bg_gray_ccc"></td></tr><tr><td height="5"></td></tr></table></body></html>]]></HTML>
<TimeTick>1410238980</TimeTick>
<NodeArgs eType="Verification" icon="10" nRep="27" status="Passed" >
<Disp><![CDATA[Checkpoint "Add Batch Profile"]]></Disp>
</NodeArgs>
</HtmlStep>
<NodeArgs eType="Context" icon="10" nRep="26" status="Passed" >
<Disp><![CDATA[Add Batch Profile]]></Disp>
</NodeArgs>
</Step>
<Step rID="T19">
<Obj plainTxt="False" ><![CDATA[Add Batch Profile.Click]]></Obj>
<Details plainTxt="False" ><![CDATA[]]></Details>
<Time><![CDATA[9/9/2014 - 12:03:00]]></Time>
<TimeTick>1410238980</TimeTick>
<NodeArgs eType="Replay" icon="10" nRep="29" >
<Disp><![CDATA[Add Batch Profile.Click]]></Disp>
</NodeArgs>
</Step>
<Step rID="T20">
<Obj plainTxt="False" ><![CDATA[BP_btn_Save_NewBP.Click]]></Obj>
<Details plainTxt="False" ><![CDATA[]]></Details>
<Time><![CDATA[9/9/2014 - 12:03:01]]></Time>
<TimeTick>1410238981</TimeTick>
<NodeArgs eType="Replay" icon="8" nRep="32" >
<Disp><![CDATA[BP_btn_Save_NewBP.Click]]></Disp>
</NodeArgs>
</Step>
<Step rID="T21">
<Obj plainTxt="False" ><![CDATA[BP_btn_err_BPNotEmpty_OK.Exist]]></Obj>
<Details plainTxt="False" ><![CDATA["Object exists"]]></Details>
<Time><![CDATA[9/9/2014 - 12:03:01]]></Time>
<TimeTick>1410238981</TimeTick>
<NodeArgs eType="Replay" icon="8" nRep="33" >
<Disp><![CDATA[BP_btn_err_BPNotEmpty_OK.Exist]]></Disp>
</NodeArgs>
</Step>
<NodeArgs eType="Context" icon="7" nRep="25" status="Passed" >
<Disp><![CDATA[New_BP_Page]]></Disp>
</NodeArgs>
</Step>
<NodeArgs eType="Context" icon="4" nRep="24" status="Passed" >
<Disp><![CDATA[eSkyDesk Management]]></Disp>
</NodeArgs>
</Step>
<Step rID="T22">
<Obj ><![CDATA[Get 'Button' with name 'BP_btn_err_BPNotEmpty_OK' at Browser 'eSkyDesk Management' successfully ]]></Obj>
<Details ><![CDATA[Passed]]></Details>
<Time><![CDATA[9/9/2014 - 12:03:04]]></Time>
<TimeTick>1410238984</TimeTick>
<NodeArgs eType="User" icon="6" nRep="34" status="Passed" >
<Disp><![CDATA[Get 'Button' with name 'BP_btn_err_BPNotEmpty_OK' at Browser 'eSkyDesk Management' successfully ]]></Disp>
</NodeArgs>
</Step>
<Step rID="T23">
<Obj plainTxt="False" ><![CDATA[eSkyDesk Management]]></Obj>
<Details plainTxt="False" ><![CDATA[Browser]]></Details>
<Time><![CDATA[9/9/2014 - 12:03:04]]></Time>
<TimeTick>1410238984</TimeTick>
<Step rID="T24">
<Obj plainTxt="False" ><![CDATA[New_BP_Page]]></Obj>
<Details plainTxt="False" ><![CDATA[Page]]></Details>
<Time><![CDATA[9/9/2014 - 12:03:04]]></Time>
<TimeTick>1410238984</TimeTick>
<Step rID="T25">
<Obj plainTxt="False" ><![CDATA[BP_btn_err_BPNotEmpty_OK.Exist]]></Obj>
<Details plainTxt="False" ><![CDATA["Object exists"]]></Details>
<Time><![CDATA[9/9/2014 - 12:03:04]]></Time>
<TimeTick>1410238984</TimeTick>
<NodeArgs eType="Replay" icon="8" nRep="38" >
<Disp><![CDATA[BP_btn_err_BPNotEmpty_OK.Exist]]></Disp>
</NodeArgs>
</Step>
<Step rID="T26">
<Obj plainTxt="False" ><![CDATA[BP_btn_err_BPNotEmpty_OK.Click]]></Obj>
<Details plainTxt="False" ><![CDATA[]]></Details>
<Time><![CDATA[9/9/2014 - 12:03:04]]></Time>
<TimeTick>1410238984</TimeTick>
<NodeArgs eType="Replay" icon="8" nRep="40" >
<Disp><![CDATA[BP_btn_err_BPNotEmpty_OK.Click]]></Disp>
</NodeArgs>
</Step>
<NodeArgs eType="Context" icon="7" nRep="37" >
<Disp><![CDATA[New_BP_Page]]></Disp>
</NodeArgs>
</Step>
<NodeArgs eType="Context" icon="4" nRep="36" >
<Disp><![CDATA[eSkyDesk Management]]></Disp>
</NodeArgs>
</Step>
<Step rID="T27">
<Obj ><![CDATA[Press button 'BP_btn_err_BPNotEmpty_OK' at Browser 'eSkyDesk Management' successfully]]></Obj>
<Details ><![CDATA[Passed]]></Details>
<Time><![CDATA[9/9/2014 - 12:03:04]]></Time>
<TimeTick>1410238984</TimeTick>
<NodeArgs eType="User" icon="6" nRep="41" status="Passed" >
<Disp><![CDATA[Press button 'BP_btn_err_BPNotEmpty_OK' at Browser 'eSkyDesk Management' successfully]]></Disp>
</NodeArgs>
</Step>
<Step rID="T28">
<Obj plainTxt="False" ><![CDATA[eSkyDesk Management]]></Obj>
<Details plainTxt="False" ><![CDATA[Browser]]></Details>
<Time><![CDATA[9/9/2014 - 12:03:05]]></Time>
<TimeTick>1410238985</TimeTick>
<Step rID="T29">
<Obj plainTxt="False" ><![CDATA[New_BP_Page]]></Obj>
<Details plainTxt="False" ><![CDATA[Page]]></Details>
<Time><![CDATA[9/9/2014 - 12:03:05]]></Time>
<TimeTick>1410238985</TimeTick>
<Step rID="T30">
<Obj plainTxt="False" ><![CDATA[BP_Name_BP.Set]]></Obj>
<Details plainTxt="False" ><![CDATA["AT_Create_BP_Successfull"]]></Details>
<Time><![CDATA[9/9/2014 - 12:03:05]]></Time>
<TimeTick>1410238985</TimeTick>
<NodeArgs eType="Replay" icon="11" nRep="45" >
<Disp><![CDATA[BP_Name_BP.Set]]></Disp>
</NodeArgs>
</Step>
<NodeArgs eType="Context" icon="7" nRep="44" >
<Disp><![CDATA[New_BP_Page]]></Disp>
</NodeArgs>
</Step>
<NodeArgs eType="Context" icon="4" nRep="43" >
<Disp><![CDATA[eSkyDesk Management]]></Disp>
</NodeArgs>
</Step>
<Step rID="T31">
<Obj ><![CDATA[Get 'Button' with name 'BP_btn_Save_NewBP' at Browser 'eSkyDesk Management' successfully ]]></Obj>
<Details ><![CDATA[Passed]]></Details>
<Time><![CDATA[9/9/2014 - 12:03:08]]></Time>
<TimeTick>1410238988</TimeTick>
<NodeArgs eType="User" icon="6" nRep="46" status="Passed" >
<Disp><![CDATA[Get 'Button' with name 'BP_btn_Save_NewBP' at Browser 'eSkyDesk Management' successfully ]]></Disp>
</NodeArgs>
</Step>
<Step rID="T32">
<Obj plainTxt="False" ><![CDATA[eSkyDesk Management]]></Obj>
<Details plainTxt="False" ><![CDATA[Browser]]></Details>
<Time><![CDATA[9/9/2014 - 12:03:08]]></Time>
<TimeTick>1410238988</TimeTick>
<Step rID="T33">
<Obj plainTxt="False" ><![CDATA[New_BP_Page]]></Obj>
<Details plainTxt="False" ><![CDATA[Page]]></Details>
<Time><![CDATA[9/9/2014 - 12:03:08]]></Time>
<TimeTick>1410238988</TimeTick>
<Step rID="T34">
<Obj plainTxt="False" ><![CDATA[BP_btn_Save_NewBP.Exist]]></Obj>
<Details plainTxt="False" ><![CDATA["Object exists"]]></Details>
<Time><![CDATA[9/9/2014 - 12:03:08]]></Time>
<TimeTick>1410238988</TimeTick>
<NodeArgs eType="Replay" icon="8" nRep="50" >
<Disp><![CDATA[BP_btn_Save_NewBP.Exist]]></Disp>
</NodeArgs>
</Step>
<Step rID="T35">
<Obj plainTxt="False" ><![CDATA[BP_btn_Save_NewBP.Click]]></Obj>
<Details plainTxt="False" ><![CDATA[]]></Details>
<Time><![CDATA[9/9/2014 - 12:03:08]]></Time>
<TimeTick>1410238988</TimeTick>
<NodeArgs eType="Replay" icon="8" nRep="52" >
<Disp><![CDATA[BP_btn_Save_NewBP.Click]]></Disp>
</NodeArgs>
</Step>
<NodeArgs eType="Context" icon="7" nRep="49" >
<Disp><![CDATA[New_BP_Page]]></Disp>
</NodeArgs>
</Step>
<NodeArgs eType="Context" icon="4" nRep="48" >
<Disp><![CDATA[eSkyDesk Management]]></Disp>
</NodeArgs>
</Step>
<Step rID="T36">
<Obj ><![CDATA[Press button 'BP_btn_Save_NewBP' at Browser 'eSkyDesk Management' successfully]]></Obj>
<Details ><![CDATA[Passed]]></Details>
<Time><![CDATA[9/9/2014 - 12:03:08]]></Time>
<TimeTick>1410238988</TimeTick>
<NodeArgs eType="User" icon="6" nRep="53" status="Passed" >
<Disp><![CDATA[Press button 'BP_btn_Save_NewBP' at Browser 'eSkyDesk Management' successfully]]></Disp>
</NodeArgs>
</Step>
<Step rID="T37">
<Obj plainTxt="False" ><![CDATA[eSkyDesk Management]]></Obj>
<Details plainTxt="False" ><![CDATA[Browser]]></Details>
<Time><![CDATA[9/9/2014 - 12:03:08]]></Time>
<TimeTick>1410238988</TimeTick>
<Step rID="T38">
<Obj plainTxt="False" ><![CDATA[New_BP_Page]]></Obj>
<Details plainTxt="False" ><![CDATA[Page]]></Details>
<Time><![CDATA[9/9/2014 - 12:03:08]]></Time>
<TimeTick>1410238988</TimeTick>
<Step rID="T39">
<Obj plainTxt="False" ><![CDATA[BP_btn_err_BPNotEmpty_OK.Exist]]></Obj>
<Details plainTxt="False" ><![CDATA["Object exists"]]></Details>
<Time><![CDATA[9/9/2014 - 12:03:08]]></Time>
<TimeTick>1410238988</TimeTick>
<NodeArgs eType="Replay" icon="8" nRep="56" >
<Disp><![CDATA[BP_btn_err_BPNotEmpty_OK.Exist]]></Disp>
</NodeArgs>
</Step>
<NodeArgs eType="Context" icon="7" nRep="55" >
<Disp><![CDATA[New_BP_Page]]></Disp>
</NodeArgs>
</Step>
<NodeArgs eType="Context" icon="4" nRep="54" >
<Disp><![CDATA[eSkyDesk Management]]></Disp>
</NodeArgs>
</Step>
<Step rID="T40">
<Obj ><![CDATA[Get 'Button' with name 'BP_btn_err_BPNotEmpty_OK' at Browser 'eSkyDesk Management' successfully ]]></Obj>
<Details ><![CDATA[Passed]]></Details>
<Time><![CDATA[9/9/2014 - 12:03:11]]></Time>
<TimeTick>1410238991</TimeTick>
<NodeArgs eType="User" icon="6" nRep="57" status="Passed" >
<Disp><![CDATA[Get 'Button' with name 'BP_btn_err_BPNotEmpty_OK' at Browser 'eSkyDesk Management' successfully ]]></Disp>
</NodeArgs>
</Step>
<Step rID="T41">
<Obj plainTxt="False" ><![CDATA[eSkyDesk Management]]></Obj>
<Details plainTxt="False" ><![CDATA[Browser]]></Details>
<Time><![CDATA[9/9/2014 - 12:03:11]]></Time>
<TimeTick>1410238991</TimeTick>
<Step rID="T42">
<Obj plainTxt="False" ><![CDATA[New_BP_Page]]></Obj>
<Details plainTxt="False" ><![CDATA[Page]]></Details>
<Time><![CDATA[9/9/2014 - 12:03:11]]></Time>
<TimeTick>1410238991</TimeTick>
<Step rID="T43">
<Obj plainTxt="False" ><![CDATA[BP_btn_err_BPNotEmpty_OK.Exist]]></Obj>
<Details plainTxt="False" ><![CDATA["Object exists"]]></Details>
<Time><![CDATA[9/9/2014 - 12:03:11]]></Time>
<TimeTick>1410238991</TimeTick>
<NodeArgs eType="Replay" icon="8" nRep="61" >
<Disp><![CDATA[BP_btn_err_BPNotEmpty_OK.Exist]]></Disp>
</NodeArgs>
</Step>
<Step rID="T44">
<Obj plainTxt="False" ><![CDATA[BP_btn_err_BPNotEmpty_OK.Click]]></Obj>
<Details plainTxt="False" ><![CDATA[]]></Details>
<Time><![CDATA[9/9/2014 - 12:03:11]]></Time>
<TimeTick>1410238991</TimeTick>
<NodeArgs eType="Replay" icon="8" nRep="63" >
<Disp><![CDATA[BP_btn_err_BPNotEmpty_OK.Click]]></Disp>
</NodeArgs>
</Step>
<NodeArgs eType="Context" icon="7" nRep="60" >
<Disp><![CDATA[New_BP_Page]]></Disp>
</NodeArgs>
</Step>
<NodeArgs eType="Context" icon="4" nRep="59" >
<Disp><![CDATA[eSkyDesk Management]]></Disp>
</NodeArgs>
</Step>
<Step rID="T45">
<Obj ><![CDATA[Press button 'BP_btn_err_BPNotEmpty_OK' at Browser 'eSkyDesk Management' successfully]]></Obj>
<Details ><![CDATA[Passed]]></Details>
<Time><![CDATA[9/9/2014 - 12:03:11]]></Time>
<TimeTick>1410238991</TimeTick>
<NodeArgs eType="User" icon="6" nRep="64" status="Passed" >
<Disp><![CDATA[Press button 'BP_btn_err_BPNotEmpty_OK' at Browser 'eSkyDesk Management' successfully]]></Disp>
</NodeArgs>
</Step>
<Step rID="T46">
<Obj plainTxt="False" ><![CDATA[[ Window ].Exist]]></Obj>
<Details plainTxt="False" ><![CDATA["Object does not exist"]]></Details>
<Time><![CDATA[9/9/2014 - 12:03:12]]></Time>
<TimeTick>1410238992</TimeTick>
<NodeArgs eType="Replay" icon="9" nRep="66" >
<Disp><![CDATA[[ Window ].Exist]]></Disp>
</NodeArgs>
</Step>
<Step rID="T47">
<Obj plainTxt="False" ><![CDATA[Run Error]]></Obj>
<Details plainTxt="False" ><![CDATA[Object required: 'WEB_BROWSER'<BR>Function file: C:\QTPF\Resource\Functions\ESD.Function.qfl<BR>Line (92): &quot;	If WEB_BROWSER.Page(&quot;New_BP_Page&quot;).WebButton(&quot;BP_btn_Add Meta Data&quot;).Exist Then&quot;.]]></Details>
<Time><![CDATA[9/9/2014 - 12:03:12]]></Time>
<TimeTick>1410238992</TimeTick>
<NodeArgs eType="Replay" icon="12" nRep="67" status="Failed" Source="C:\QTPF\Resource\Functions\ESD.Function.qfl" SourceLine="91" >
<Disp><![CDATA[Run Error]]></Disp>
</NodeArgs>
</Step>
<Step rID="T48">
<Obj plainTxt="False" ><![CDATA[Stop Run]]></Obj>
<Details plainTxt="False" ><![CDATA[Run stopped by user.]]></Details>
<Time><![CDATA[9/9/2014 - 12:03:16]]></Time>
<TimeTick>1410238996</TimeTick>
<NodeArgs eType="General" icon="13" nRep="68" >
<Disp><![CDATA[Stop Run]]></Disp>
</NodeArgs>
</Step>
<Summary sTime="9/9/2014 - 12:02:44" eTime="9/9/2014 - 12:03:16" passed="9" failed="1" warnings="0" ></Summary>
<NodeArgs eType="StartAction" icon="5" nRep="12" status="Failed" >
<Disp><![CDATA[ESD Summary]]></Disp>
</NodeArgs>
</Action>
<NodeArgs eType="StartIteration" icon="3" nRep="6" status="Failed" >
<Disp><![CDATA[ESD_Test Iteration 1 (Row 1)]]></Disp>
</NodeArgs>
</DIter>
<Summary sTime="9/9/2014 - 12:02:42" eTime="9/9/2014 - 12:03:16" passed="9" failed="1" warnings="0" ></Summary>
<NodeArgs eType="StartTest" icon="1" nRep="3" status="Failed" >
<Disp><![CDATA[Test ESD_Test Summary]]></Disp>
</NodeArgs>
</Doc>
</Report>